### ISSUE TITLE
Tuya Connection??

### ISSUE THREAD

**Issue by ukiews** [death2all110/ha-taylorgrill#1]
You mention Tuya in the Warnings section.
Does this mean that the device could potentially connect via Tuya local integration?
That would seem to make more sense, rather than using mqtt.

**Comment by ukiews** [comment]
Regarding the instructions, what firmware are you using for testing.
I seem to be getting issues authenticating. 
I've added the Tayor pw as instructed. I am able to use it with mqtt explorer to authenticate.
Have nat setup as follows:

<img width="371" height="987" alt="Image" src="https://github.com/user-attachments/assets/8943dcd3-3e78-4673-8612-edef186f434d" />

192.168.1.14 is the controller and .230 the mosquitto broker.

Here is the tcpdump:

```
23:52:22.027224 eth0  Out IP 192.168.1.230.1883 > 192.168.1.14.55254: Flags [S.], seq 768310994, ack 8545, win 64240, options [mss 1460], length 0
23:52:22.232444 eth0  In  IP 192.168.1.14.55254 > 192.168.1.230.1883: Flags [R.], seq 1, ack 1, win 5744, length 0
23:52:25.003397 eth0  In  IP 192.168.1.14.55254 > 192.168.1.230.1883: Flags [S], seq 8544, win 5744, options [mss 1436], length 0
23:52:25.003519 eth0  Out IP 192.168.1.230.1883 > 192.168.1.14.55254: Flags [S.], seq 814815686, ack 8545, win 64240, options [mss 1460], length 0
23:52:25.093517 eth0  In  IP 192.168.1.14.55254 > 192.168.1.230.1883: Flags [R.], seq 1, ack 1, win 5744, length 0
23:52:27.952709 eth0  In  IP 192.168.1.14.55254 > 192.168.1.230.1883: Flags [S], seq 8544, win 5744, options [mss 1436], length 0
23:52:27.952841 eth0  Out IP 192.168.1.230.1883 > 192.168.1.14.55254: Flags [S.], seq 860898784, ack 8545, win 64240, options [mss 1460], length 0
23:52:27.966728 eth0  In  IP 192.168.1.14.55254 > 192.168.1.230.1883: Flags [R.], seq 1, ack 1, win 5744, length 0
23:52:39.842216 eth0  B   ARP, Request who-has 192.168.1.14 tell 192.168.1.14, length 46
23:52:43.447790 eth0  In  IP 192.168.1.14.55255 > 192.168.1.230.1883: Flags [S], seq 8951, win 5744, options [mss 1436], length 0
23:52:43.447930 eth0  Out IP 192.168.1.230.1883 > 192.168.1.14.55255: Flags [S.], seq 3019627901, ack 8952, win 64240, options [mss 1460], length 0
23:52:43.550713 eth0  In  IP 192.168.1.14.55255 > 192.168.1.230.1883: Flags [R.], seq 1, ack 1, win 5744, length 0
23:52:46.499956 eth0  In  IP 192.168.1.14.55255 > 192.168.1.230.1883: Flags [S], seq 8951, win 5744, options [mss 1436], length 0
23:52:46.500105 eth0  Out IP 192.168.1.230.1883 > 192.168.1.14.55255: Flags [S.], seq 3067318128, ack 8952, win 64240, options [mss 1460], length 0
23:52:46.516570 eth0  In  IP 192.168.1.14.55255 > 192.168.1.230.1883: Flags [R.], seq 1, ack 1, win 5744, length 0
23:52:48.475811 eth0  Out ARP, Request who-has 192.168.1.14 tell 192.168.1.230, length 28
23:52:48.555775 eth0  In  ARP, Reply 192.168.1.14 is-at 38:18:2b:11:5c:a0, length 46
23:52:49.484085 eth0  In  IP 192.168.1.14.55255 > 192.168.1.230.1883: Flags [S], seq 8951, win 5744, options [mss 1436], length 0
23:52:49.484165 eth0  Out IP 192.168.1.230.1883 > 192.168.1.14.55255: Flags [S.], seq 3113944367, ack 8952, win 64240, options [mss 1460], length 0
23:52:49.568240 eth0  In  IP 192.168.1.14.55255 > 192.168.1.230.1883: Flags [R.], seq 1, ack 1, win 5744, length 0
23:52:52.536338 eth0  In  IP 192.168.1.14.55255 > 192.168.1.230.1883: Flags [S], seq 8951, win 5744, options [mss 1436], length 0
23:52:52.536470 eth0  Out IP 192.168.1.230.1883 > 192.168.1.14.55255: Flags [S.], seq 3161636415, ack 8952, win 64240, options [mss 1460], length 0
23:52:52.662366 eth0  In  IP 192.168.1.14.55255 > 192.168.1.230.1883: Flags [R.], seq 1, ack 1, win 5744, length 0
23:52:55.507154 eth0  In  IP 192.168.1.14.55255 > 192.168.1.230.1883: Flags [S], seq 8951, win 5744, options [mss 1436], length 0
23:52:55.507299 eth0  Out IP 192.168.1.230.1883 > 192.168.1.14.55255: Flags [S.], seq 3208055616, ack 8952, win 64240, options [mss 1460], length 0
23:52:55.631874 eth0  In  IP 192.168.1.14.55255 > 192.168.1.230.1883: Flags [R.], seq 1, ack 1, win 5744, length 0
23:52:58.490916 eth0  In  IP 192.168.1.14.55255 > 192.168.1.230.1883: Flags [S], seq 8951, win 5744, options [mss 1436], length 0
23:52:58.491058 eth0  Out IP 192.168.1.230.1883 > 192.168.1.14.55255: Flags [S.], seq 3254676838, ack 8952, win 64240, options [mss 1460], length 0
23:52:58.805090 eth0  In  IP 192.168.1.14.55255 > 192.168.1.230.1883: Flags [R.], seq 1, ack 1, win 5744, length 0
23:53:01.466849 eth0  In  IP 192.168.1.14.55255 > 192.168.1.230.1883: Flags [S], seq 8951, win 5744, options [mss 1436], length 0
23:53:01.466993 eth0  Out IP 192.168.1.230.1883 > 192.168.1.14.55255: Flags [S.], seq 3301175790, ack 8952, win 64240, options [mss 1460], length 0
23:53:01.544121 eth0  In  IP 192.168.1.14.55255 > 192.168.1.230.1883: Flags [R.], seq 1, ack 1, win 5744, length 0
23:53:11.989934 eth0  In  IP 192.168.1.14.55256 > 192.168.1.230.1883: Flags [S], seq 9395, win 5744, options [mss 1436], length 0
23:53:11.990078 eth0  Out IP 192.168.1.230.1883 > 192.168.1.14.55256: Flags [S.], seq 928364859, ack 9396, win 64240, options [mss 1460], length 0
23:53:12.102101 eth0  In  IP 192.168.1.14.55256 > 192.168.1.230.1883: Flags [R.], seq 1, ack 1, win 5744, length 0
23:53:14.972899 eth0  In  IP 192.168.1.14.55256 > 192.168.1.230.1883: Flags [S], seq 9395, win 5744, options [mss 1436], length 0
23:53:14.973028 eth0  Out IP 192.168.1.230.1883 > 192.168.1.14.55256: Flags [S.], seq 974973509, ack 9396, win 64240, options [mss 1460], length 0
23:53:14.987074 eth0  In  IP 192.168.1.14.55256 > 192.168.1.230.1883: Flags [R.], seq 1, ack 1, win 5744, length 0
23:53:18.041032 eth0  In  IP 192.168.1.14.55256 > 192.168.1.230.1883: Flags [S], seq 9395, win 5744, options [mss 1436], length 0
23:53:18.041181 eth0  Out IP 192.168.1.230.1883 > 192.168.1.14.55256: Flags [S.], seq 1022913312, ack 9396, win 64240, options [mss 1460], length 0
23:53:18.259196 eth0  In  IP 192.168.1.14.55256 > 192.168.1.230.1883: Flags [R.], seq 1, ack 1, win 5744, length 0
23:53:21.001268 eth0  In  IP 192.168.1.14.55256 > 192.168.1.230.1883: Flags [S], seq 9395, win 5744, options [mss 1436], length 0
23:53:21.001413 eth0  Out IP 192.168.1.230.1883 > 192.168.1.14.55256: Flags [S.], seq 1069166950, ack 9396, win 64240, options [mss 1460], length 0
23:53:21.125920 eth0  In  IP 192.168.1.14.55256 > 192.168.1.230.1883: Flags [R.], seq 1, ack 1, win 5744, length 0
23:53:23.969706 eth0  In  IP 192.168.1.14.55256 > 192.168.1.230.1883: Flags [S], seq 9395, win 5744, options [mss 1436], length 0
23:53:23.969845 eth0  Out IP 192.168.1.230.1883 > 192.168.1.14.55256: Flags [S.], seq 1115548684, ack 9396, win 64240, options [mss 1460], length 0
23:53:24.077288 eth0  In  IP 192.168.1.14.55256 > 192.168.1.230.1883: Flags [R.], seq 1, ack 1, win 5744, length 0
23:53:26.111641 eth0  Out ARP, Request who-has 192.168.1.14 tell 192.168.1.230, length 28
23:53:26.244235 eth0  In  ARP, Reply 192.168.1.14 is-at 38:18:2b:11:5c:a0, length 46
23:53:27.046182 eth0  In  IP 192.168.1.14.55256 > 192.168.1.230.1883: Flags [S], seq 9395, win 5744, options [mss 1436], length 0
23:53:27.046325 eth0  Out IP 192.168.1.230.1883 > 192.168.1.14.55256: Flags [S.], seq 1163618749, ack 9396, win 64240, options [mss 1460], length 0
23:53:27.144824 eth0  In  IP 192.168.1.14.55256 > 192.168.1.230.1883: Flags [R.], seq 1, ack 1, win 5744, length 0
23:53:30.013089 eth0  In  IP 192.168.1.14.55256 > 192.168.1.230.1883: Flags [S], seq 9395, win 5744, options [mss 1436], length 0
```

**Comment by death2all110** [comment]
Do you have any logs from your MQTT broker? 

I don't have the version of the fw available, but can get it for you later. I have not had success in getting the Tuya app to see it. I'll update the readme as the firmware I dumped shows no evidence of being Tuya based. I just did the dump and analysis a couple days ago.

Sorry for the late reply btw. GitHub didn't notify me of a new issue being created!

**Comment by ukiews** [comment]
It does not ever seem to get to the mqtt broker. It almost seems like the controller is checking to verify the destination ip and when it does not match, it quits.

**Comment by death2all110** [comment]
Did you set up a Masquerade rule as well? Basically what's happening right now from what I see in the dump, is the controller is reaching the MQTT Broker (through the NAT), and the Broker is responding, but your controller is rejecting the response.

I realize now the that I forgot this step in the readme. 🤦

I'll fix it when I get home in a couple hours. So very sorry about that!!

**Comment by ukiews** [comment]
Ok thank you. Yes, not aware of a masquerade rule.

**Comment by death2all110** [comment]
Yeah, sorry, you need a Destination NAT rule (which you've got) and a Source NAT/Masquerade rule. I'll fix it in a bit, sorry again!

**Comment by death2all110** [comment]
Updated the readme. Let me know if the Masquerade rule resolves the issue!

**Comment by ukiews** [comment]
Looks like it is now communicating with the mqtt broker.
But all it is reporting is:

<img width="654" height="184" alt="Image" src="https://github.com/user-attachments/assets/ef9d9447-6d93-486c-954f-8e2804f48ec7" />

Here is my masquerade rule:

<img width="556" height="1470" alt="Image" src="https://github.com/user-attachments/assets/2b0dceb1-fedd-4b3f-86c7-16c7d1f3aa55" />
Does this look correct? Or do I actually need to use 'Src. NAT' instead of Masquerade?

**Comment by ukiews** [comment]
Control does appear to work, but it is not reporting the internal probe temperature for example.

**Comment by death2all110** [comment]
Yes, the rule looks fine, and since you confirmed control is working I don't think its an issue there. You're using this with homeassistant, correct? Let me see if I can get a new version out with debug logging added. 

I'd also make sure to unplug/plug the smoker back in just to ensure it doesn't have any old DNS paths cached. 

What version firmware is your device on? The app should still work over Bluetooth, so if you're in bluetooth range, You should be able to open the app and go to Setup>ID: GRILLSXXXXXXXXX and it should show the ID, Firmware Version, and App Version. My firmware is 1.2.6

**Comment by ukiews** [comment]
Yes, using with this HA integration:

<img width="1506" height="686" alt="Image" src="https://github.com/user-attachments/assets/d3016853-1258-400f-9cd4-43dbde3b50d0" />

I'd have to check the firmware.
Thank you for the progress thus far.

**Comment by death2all110** [comment]
Just pushed a release with debug logging added. 
Once installed, enable debug logging, and hold the internal probe in your hand or pinch it between 2 fingers for a couple minutes to ensure it pushes updates, then turn off debug logging. It should download a txt file. If you upload that here, I can investigate further.

**Comment by death2all110** [comment]
@ukiews 

Quick update. I just had this happen myself. I had assumed that the device was "active" in sending data, but it looks like it is actually "passive" and wants a "handshake" command sent before it starts responding. I decompiled the android APK and found that the app sends this when the app first connects to it and about every 5 seconds it requests data from the smoker. I am working on making these code changes and will have a new release out late this evening, that **should** hopefully fix the issue.

Update: Code has been updated. I will have the release ready shortly.

**Comment by death2all110** [comment]
@ukiews Ok, the release is out. You should be good to go now!

**Comment by ukiews** [comment]
Looks like it is working!
Would it possible to read and report on any other states of the controller? Like the auger and heating element? Or if an error is reported?

**Comment by ukiews** [comment]
One strange thing I’m noticing is that the “actual” temp displayed on the controller is showing as much higher than what is being reported in the app. 
Controller says 360F, app says 327F. 

Also if set temp is changed manually on controller, it does not seem to report back to the app. Or vise versa.

**Comment by death2all110** [comment]
> Looks like it is working! Would it possible to read and report on any other states of the controller? Like the auger and heating element? Or if an error is reported?

I branched that into a separate issue to look into. In my research, I haven't isolated those, but I also wasn't really looking for these.


> One strange thing I’m noticing is that the “actual” temp displayed on the controller is showing as much higher than what is being reported in the app. Controller says 360F, app says 327F.
> 
> Also if set temp is changed manually on controller, it does not seem to report back to the app. Or vise versa.

This is likely due to the delay in polling. The stock app polls every ~5sec. I did 30s as a default, but this can be configured as you wish, with a 5 sec minimum. Some people don't like it when things are incredibly talkative. With 30s poll I notice its total time is ~55s for the controller to respond back to HA. So 5s should get it back to 10s (assuming it scales like that). On Wifi with the stock app it was roughly 30s as it was going through their cloud which is slow, at least in my experience. Bluetooth would likely be much faster. And I can look into supporting bluetooth, but the bluetooth range on these controllers is atrocious.

**Comment by ukiews** [comment]
I see now the polling setting. Thank you!
However, are you sure that the set temp is working properly? I waited well over 5 minutes, then when I went to the controller, the set temp was something completely different from what I set in app.

**Comment by death2all110** [comment]
> I see now the polling setting. Thank you! However, are you sure that the set temp is working properly? I waited well over 5 minutes, then when I went to the controller, the set temp was something completely different from what I set in app.

Sorry, I must have missed that question. Yikes! Can you provide an example of what you set it to in HA and what it said on the physical controller, so I can attempt to reproduce?

Also, can you capture debug logging of this please?

**Comment by ukiews** [comment]
I set the temp to 180F. When going to set on the controller, it is showing 350F
I then adjust to 300 on the controller, app does not update.
Log:


```
2026-01-09 19:31:10.763 DEBUG (MainThread) [custom_components.taylor_grill.climate] Sending Set Temp 180 (180F) Command: fa09fe0501010800ff
2026-01-09 19:31:12.396 DEBUG (MainThread) [custom_components.taylor_grill.climate] RAW MQTT PACKET (Climate): fa18fe0b02020000000000000000000000000100000000ff
2026-01-09 19:31:12.397 DEBUG (MainThread) [custom_components.taylor_grill.sensor] RAW MQTT PACKET: fa18fe0b02020000000000000000000000000100000000ff
2026-01-09 19:31:12.397 DEBUG (MainThread) [custom_components.taylor_grill.sensor] RAW MQTT PACKET: fa18fe0b02020000000000000000000000000100000000ff
2026-01-09 19:31:12.397 DEBUG (MainThread) [custom_components.taylor_grill.climate] RAW MQTT PACKET (Climate): fa18fe0b02020000000000000000000000000100000000ff
2026-01-09 19:31:12.406 DEBUG (MainThread) [custom_components.taylor_grill.climate] RAW MQTT PACKET (Climate): fa32fe0e090600090600090600000000000000000000000705fffe0d020205020205020205000000000000000000030500ff
2026-01-09 19:31:12.406 DEBUG (MainThread) [custom_components.taylor_grill.sensor] RAW MQTT PACKET: fa32fe0e090600090600090600000000000000000000000705fffe0d020205020205020205000000000000000000030500ff
2026-01-09 19:31:12.407 DEBUG (MainThread) [custom_components.taylor_grill.sensor] RAW MQTT PACKET: fa32fe0e090600090600090600000000000000000000000705fffe0d020205020205020205000000000000000000030500ff
2026-01-09 19:31:12.407 DEBUG (MainThread) [custom_components.taylor_grill.climate] RAW MQTT PACKET (Climate): fa32fe0e090600090600090600000000000000000000000705fffe0d020205020205020205000000000000000000030500ff
2026-01-09 19:31:14.060 DEBUG (MainThread) [custom_components.taylor_grill.climate] RAW MQTT PACKET (Climate): fa48fe0b02020000000000000000000000000100000000fffe0e090600090600090600000000000000000000000705fffe0d020205020205020205000000000000000000030500ff
2026-01-09 19:31:14.060 DEBUG (MainThread) [custom_components.taylor_grill.sensor] RAW MQTT PACKET: fa48fe0b02020000000000000000000000000100000000fffe0e090600090600090600000000000000000000000705fffe0d020205020205020205000000000000000000030500ff
2026-01-09 19:31:14.060 DEBUG (MainThread) [custom_components.taylor_grill.sensor] RAW MQTT PACKET: fa48fe0b02020000000000000000000000000100000000fffe0e090600090600090600000000000000000000000705fffe0d020205020205020205000000000000000000030500ff
2026-01-09 19:31:14.060 DEBUG (MainThread) [custom_components.taylor_grill.climate] RAW MQTT PACKET (Climate): fa48fe0b02020000000000000000000000000100000000fffe0e090600090600090600000000000000000000000705fffe0d020205020205020205000000000000000000030500ff
2026-01-09 19:31:17.933 DEBUG (MainThread) [custom_components.taylor_grill.climate] Sending ON Command: fa06fe0101ff
2026-01-09 19:31:18.057 DEBUG (MainThread) [custom_components.taylor_grill.climate] RAW MQTT PACKET (Climate): fa06fe0101ff
2026-01-09 19:31:18.057 DEBUG (MainThread) [custom_components.taylor_grill.sensor] RAW MQTT PACKET: fa06fe0101ff
2026-01-09 19:31:18.057 DEBUG (MainThread) [custom_components.taylor_grill.sensor] RAW MQTT PACKET: fa06fe0101ff
2026-01-09 19:31:18.057 DEBUG (MainThread) [custom_components.taylor_grill.climate] RAW MQTT PACKET (Climate): fa06fe0101ff
2026-01-09 19:31:32.564 DEBUG (MainThread) [custom_components.taylor_grill.climate] RAW MQTT PACKET (Climate): fa18fe0b02010000000000000000000000000100000000ff
2026-01-09 19:31:32.564 DEBUG (MainThread) [custom_components.taylor_grill.sensor] RAW MQTT PACKET: fa18fe0b02010000000000000000000000000100000000ff
2026-01-09 19:31:32.564 DEBUG (MainThread) [custom_components.taylor_grill.sensor] RAW MQTT PACKET: fa18fe0b02010000000000000000000000000100000000ff
2026-01-09 19:31:32.565 DEBUG (MainThread) [custom_components.taylor_grill.climate] RAW MQTT PACKET (Climate): fa18fe0b02010000000000000000000000000100000000ff
2026-01-09 19:31:32.574 DEBUG (MainThread) [custom_components.taylor_grill.climate] RAW MQTT PACKET (Climate): fa32fe0e090600090600090600000000000000000000000705fffe0d020205020205020205000000000000000000030500ff
2026-01-09 19:31:32.574 DEBUG (MainThread) [custom_components.taylor_grill.sensor] RAW MQTT PACKET: fa32fe0e090600090600090600000000000000000000000705fffe0d020205020205020205000000000000000000030500ff
2026-01-09 19:31:32.574 DEBUG (MainThread) [custom_components.taylor_grill.sensor] RAW MQTT PACKET: fa32fe0e090600090600090600000000000000000000000705fffe0d020205020205020205000000000000000000030500ff
2026-01-09 19:31:32.575 DEBUG (MainThread) [custom_components.taylor_grill.climate] RAW MQTT PACKET (Climate): fa32fe0e090600090600090600000000000000000000000705fffe0d020205020205020205000000000000000000030500ff
2026-01-09 19:31:33.986 DEBUG (MainThread) [custom_components.taylor_grill.climate] RAW MQTT PACKET (Climate): fa18fe0b02010000000000000000000000000100000000ff
2026-01-09 19:31:33.987 DEBUG (MainThread) [custom_components.taylor_grill.sensor] RAW MQTT PACKET: fa18fe0b02010000000000000000000000000100000000ff
2026-01-09 19:31:33.987 DEBUG (MainThread) [custom_components.taylor_grill.sensor] RAW MQTT PACKET: fa18fe0b02010000000000000000000000000100000000ff
2026-01-09 19:31:33.987 DEBUG (MainThread) [custom_components.taylor_grill.climate] RAW MQTT PACKET (Climate): fa18fe0b02010000000000000000000000000100000000ff
2026-01-09 19:31:34.089 DEBUG (MainThread) [custom_components.taylor_grill.climate] RAW MQTT PACKET (Climate): fa32fe0e090600090600090600000000000000000000000705fffe0d020205020205020205000000000000000000030500ff
2026-01-09 19:31:34.090 DEBUG (MainThread) [custom_components.taylor_grill.sensor] RAW MQTT PACKET: fa32fe0e090600090600090600000000000000000000000705fffe0d020205020205020205000000000000000000030500ff
2026-01-09 19:31:34.090 DEBUG (MainThread) [custom_components.taylor_grill.sensor] RAW MQTT PACKET: fa32fe0e090600090600090600000000000000000000000705fffe0d020205020205020205000000000000000000030500ff
2026-01-09 19:31:34.090 DEBUG (MainThread) [custom_components.taylor_grill.climate] RAW MQTT PACKET (Climate): fa32fe0e090600090600090600000000000000000000000705fffe0d020205020205020205000000000000000000030500ff
2026-01-09 19:31:52.752 DEBUG (MainThread) [custom_components.taylor_grill.climate] RAW MQTT PACKET (Climate): fa18fe0b02010000000000000000000000000100000000ff
2026-01-09 19:31:52.752 DEBUG (MainThread) [custom_components.taylor_grill.sensor] RAW MQTT PACKET: fa18fe0b02010000000000000000000000000100000000ff
2026-01-09 19:31:52.752 DEBUG (MainThread) [custom_components.taylor_grill.sensor] RAW MQTT PACKET: fa18fe0b02010000000000000000000000000100000000ff
2026-01-09 19:31:52.752 DEBUG (MainThread) [custom_components.taylor_grill.climate] RAW MQTT PACKET (Climate): fa18fe0b02010000000000000000000000000100000000ff
2026-01-09 19:31:52.763 DEBUG (MainThread) [custom_components.taylor_grill.climate] RAW MQTT PACKET (Climate): fa32fe0e090600090600090600000000000000000000000705fffe0d020205020205020205000000000000000000030500ff
2026-01-09 19:31:52.764 DEBUG (MainThread) [custom_components.taylor_grill.sensor] RAW MQTT PACKET: fa32fe0e090600090600090600000000000000000000000705fffe0d020205020205020205000000000000000000030500ff
2026-01-09 19:31:52.764 DEBUG (MainThread) [custom_components.taylor_grill.sensor] RAW MQTT PACKET: fa32fe0e090600090600090600000000000000000000000705fffe0d020205020205020205000000000000000000030500ff
2026-01-09 19:31:52.764 DEBUG (MainThread) [custom_components.taylor_grill.climate] RAW MQTT PACKET (Climate): fa32fe0e090600090600090600000000000000000000000705fffe0d020205020205020205000000000000000000030500ff
2026-01-09 19:31:54.057 DEBUG (MainThread) [custom_components.taylor_grill.climate] RAW MQTT PACKET (Climate): fa18fe0b02010000000000000000000000000100000000ff
2026-01-09 19:31:54.058 DEBUG (MainThread) [custom_components.taylor_grill.sensor] RAW MQTT PACKET: fa18fe0b02010000000000000000000000000100000000ff
2026-01-09 19:31:54.058 DEBUG (MainThread) [custom_components.taylor_grill.sensor] RAW MQTT PACKET: fa18fe0b02010000000000000000000000000100000000ff
2026-01-09 19:31:54.058 DEBUG (MainThread) [custom_components.taylor_grill.climate] RAW MQTT PACKET (Climate): fa18fe0b02010000000000000000000000000100000000ff
2026-01-09 19:31:54.159 DEBUG (MainThread) [custom_components.taylor_grill.climate] RAW MQTT PACKET (Climate): fa32fe0e090600090600090600000000000000000000000705fffe0d020205020205020205000000000000000000030500ff
2026-01-09 19:31:54.159 DEBUG (MainThread) [custom_components.taylor_grill.sensor] RAW MQTT PACKET: fa32fe0e090600090600090600000000000000000000000705fffe0d020205020205020205000000000000000000030500ff
2026-01-09 19:31:54.160 DEBUG (MainThread) [custom_components.taylor_grill.sensor] RAW MQTT PACKET: fa32fe0e090600090600090600000000000000000000000705fffe0d020205020205020205000000000000000000030500ff
2026-01-09 19:31:54.160 DEBUG (MainThread) [custom_components.taylor_grill.climate] RAW MQTT PACKET (Climate): fa32fe0e090600090600090600000000000000000000000705fffe0d020205020205020205000000000000000000030500ff
2026-01-09 19:32:12.829 DEBUG (MainThread) [custom_components.taylor_grill.climate] RAW MQTT PACKET (Climate): fa18fe0b02010000000000000000000000000100000000ff
2026-01-09 19:32:12.829 DEBUG (MainThread) [custom_components.taylor_grill.sensor] RAW MQTT PACKET: fa18fe0b02010000000000000000000000000100000000ff
2026-01-09 19:32:12.829 DEBUG (MainThread) [custom_components.taylor_grill.sensor] RAW MQTT PACKET: fa18fe0b02010000000000000000000000000100000000ff
2026-01-09 19:32:12.829 DEBUG (MainThread) [custom_components.taylor_grill.climate] RAW MQTT PACKET (Climate): fa18fe0b02010000000000000000000000000100000000ff
2026-01-09 19:32:12.839 DEBUG (MainThread) [custom_components.taylor_grill.climate] RAW MQTT PACKET (Climate): fa32fe0e090600090600090600000000000000000000000705fffe0d020205020205020205000000000000000000030500ff
2026-01-09 19:32:12.839 DEBUG (MainThread) [custom_components.taylor_grill.sensor] RAW MQTT PACKET: fa32fe0e090600090600090600000000000000000000000705fffe0d020205020205020205000000000000000000030500ff
2026-01-09 19:32:12.839 DEBUG (MainThread) [custom_components.taylor_grill.sensor] RAW MQTT PACKET: fa32fe0e090600090600090600000000000000000000000705fffe0d020205020205020205000000000000000000030500ff
2026-01-09 19:32:12.840 DEBUG (MainThread) [custom_components.taylor_grill.climate] RAW MQTT PACKET (Climate): fa32fe0e090600090600090600000000000000000000000705fffe0d020205020205020205000000000000000000030500ff
2026-01-09 19:32:13.948 DEBUG (MainThread) [custom_components.taylor_grill.climate] RAW MQTT PACKET (Climate): fa18fe0b02010000000000000000000000000100000000ff
2026-01-09 19:32:13.948 DEBUG (MainThread) [custom_components.taylor_grill.sensor] RAW MQTT PACKET: fa18fe0b02010000000000000000000000000100000000ff
2026-01-09 19:32:13.948 DEBUG (MainThread) [custom_components.taylor_grill.sensor] RAW MQTT PACKET: fa18fe0b02010000000000000000000000000100000000ff
2026-01-09 19:32:13.948 DEBUG (MainThread) [custom_components.taylor_grill.climate] RAW MQTT PACKET (Climate): fa18fe0b02010000000000000000000000000100000000ff
2026-01-09 19:32:14.127 DEBUG (MainThread) [custom_components.taylor_grill.climate] RAW MQTT PACKET (Climate): fa32fe0e090600090600090600000000000000000000000705fffe0d020205020205020205000000000000000000030500ff
2026-01-09 19:32:14.127 DEBUG (MainThread) [custom_components.taylor_grill.sensor] RAW MQTT PACKET: fa32fe0e090600090600090600000000000000000000000705fffe0d020205020205020205000000000000000000030500ff
2026-01-09 19:32:14.127 DEBUG (MainThread) [custom_components.taylor_grill.sensor] RAW MQTT PACKET: fa32fe0e090600090600090600000000000000000000000705fffe0d020205020205020205000000000000000000030500ff
2026-01-09 19:32:14.128 DEBUG (MainThread) [custom_components.taylor_grill.climate] RAW MQTT PACKET (Climate): fa32fe0e090600090600090600000000000000000000000705fffe0d020205020205020205000000000000000000030500ff
2026-01-09 19:32:33.071 DEBUG (MainThread) [custom_components.taylor_grill.climate] RAW MQTT PACKET (Climate): fa18fe0b02010000000000000000000000000100000000ff
2026-01-09 19:32:33.072 DEBUG (MainThread) [custom_components.taylor_grill.sensor] RAW MQTT PACKET: fa18fe0b02010000000000000000000000000100000000ff
2026-01-09 19:32:33.072 DEBUG (MainThread) [custom_components.taylor_grill.sensor] RAW MQTT PACKET: fa18fe0b02010000000000000000000000000100000000ff
2026-01-09 19:32:33.072 DEBUG (MainThread) [custom_components.taylor_grill.climate] RAW MQTT PACKET (Climate): fa18fe0b02010000000000000000000000000100000000ff
2026-01-09 19:32:33.097 DEBUG (MainThread) [custom_components.taylor_grill.climate] RAW MQTT PACKET (Climate): fa32fe0e090600090600090600000000000000000000000705fffe0d020205020205020205000000000000000000030500ff
2026-01-09 19:32:33.098 DEBUG (MainThread) [custom_components.taylor_grill.sensor] RAW MQTT PACKET: fa32fe0e090600090600090600000000000000000000000705fffe0d020205020205020205000000000000000000030500ff
2026-01-09 19:32:33.098 DEBUG (MainThread) [custom_components.taylor_grill.sensor] RAW MQTT PACKET: fa32fe0e090600090600090600000000000000000000000705fffe0d020205020205020205000000000000000000030500ff
2026-01-09 19:32:33.098 DEBUG (MainThread) [custom_components.taylor_grill.climate] RAW MQTT PACKET (Climate): fa32fe0e090600090600090600000000000000000000000705fffe0d020205020205020205000000000000000000030500ff
2026-01-09 19:32:33.993 DEBUG (MainThread) [custom_components.taylor_grill.climate] RAW MQTT PACKET (Climate): fa18fe0b02010000000000000000000000000100000000ff
2026-01-09 19:32:33.994 DEBUG (MainThread) [custom_components.taylor_grill.sensor] RAW MQTT PACKET: fa18fe0b02010000000000000000000000000100000000ff
2026-01-09 19:32:33.994 DEBUG (MainThread) [custom_components.taylor_grill.sensor] RAW MQTT PACKET: fa18fe0b02010000000000000000000000000100000000ff
2026-01-09 19:32:33.994 DEBUG (MainThread) [custom_components.taylor_grill.climate] RAW MQTT PACKET (Climate): fa18fe0b02010000000000000000000000000100000000ff
2026-01-09 19:32:34.116 DEBUG (MainThread) [custom_components.taylor_grill.climate] RAW MQTT PACKET (Climate): fa32fe0e090600090600090600000000000000000000000705fffe0d020205020205020205000000000000000000030500ff
2026-01-09 19:32:34.117 DEBUG (MainThread) [custom_components.taylor_grill.sensor] RAW MQTT PACKET: fa32fe0e090600090600090600000000000000000000000705fffe0d020205020205020205000000000000000000030500ff
2026-01-09 19:32:34.117 DEBUG (MainThread) [custom_components.taylor_grill.sensor] RAW MQTT PACKET: fa32fe0e090600090600090600000000000000000000000705fffe0d020205020205020205000000000000000000030500ff
2026-01-09 19:32:34.117 DEBUG (MainThread) [custom_components.taylor_grill.climate] RAW MQTT PACKET (Climate): fa32fe0e090600090600090600000000000000000000000705fffe0d020205020205020205000000000000000000030500ff
2026-01-09 19:32:53.163 DEBUG (MainThread) [custom_components.taylor_grill.climate] RAW MQTT PACKET (Climate): fa18fe0b01010000000000000000000000000100000000ff
2026-01-09 19:32:53.163 DEBUG (MainThread) [custom_components.taylor_grill.sensor] RAW MQTT PACKET: fa18fe0b01010000000000000000000000000100000000ff
2026-01-09 19:32:53.163 DEBUG (MainThread) [custom_components.taylor_grill.sensor] RAW MQTT PACKET: fa18fe0b01010000000000000000000000000100000000ff
2026-01-09 19:32:53.163 DEBUG (MainThread) [custom_components.taylor_grill.climate] RAW MQTT PACKET (Climate): fa18fe0b01010000000000000000000000000100000000ff
2026-01-09 19:32:53.173 DEBUG (MainThread) [custom_components.taylor_grill.climate] RAW MQTT PACKET (Climate): fa32fe0e090600090600090600000000000000000000000705fffe0d020205020205020205000000000000000000020905ff
2026-01-09 19:32:53.173 DEBUG (MainThread) [custom_components.taylor_grill.sensor] RAW MQTT PACKET: fa32fe0e090600090600090600000000000000000000000705fffe0d020205020205020205000000000000000000020905ff
2026-01-09 19:32:53.173 DEBUG (MainThread) [custom_components.taylor_grill.sensor] RAW MQTT PACKET: fa32fe0e090600090600090600000000000000000000000705fffe0d020205020205020205000000000000000000020905ff
2026-01-09 19:32:53.173 DEBUG (MainThread) [custom_components.taylor_grill.climate] RAW MQTT PACKET (Climate): fa32fe0e090600090600090600000000000000000000000705fffe0d020205020205020205000000000000000000020905ff
2026-01-09 19:32:54.064 DEBUG (MainThread) [custom_components.taylor_grill.climate] RAW MQTT PACKET (Climate): fa18fe0b02010000000000000000000000000100000000ff
2026-01-09 19:32:54.065 DEBUG (MainThread) [custom_components.taylor_grill.sensor] RAW MQTT PACKET: fa18fe0b02010000000000000000000000000100000000ff
2026-01-09 19:32:54.065 DEBUG (MainThread) [custom_components.taylor_grill.sensor] RAW MQTT PACKET: fa18fe0b02010000000000000000000000000100000000ff
2026-01-09 19:32:54.065 DEBUG (MainThread) [custom_components.taylor_grill.climate] RAW MQTT PACKET (Climate): fa18fe0b02010000000000000000000000000100000000ff
2026-01-09 19:32:54.167 DEBUG (MainThread) [custom_components.taylor_grill.climate] RAW MQTT PACKET (Climate): fa32fe0e090600090600090600000000000000000000000705fffe0d020205020205020205000000000000000000030000ff
2026-01-09 19:32:54.167 DEBUG (MainThread) [custom_components.taylor_grill.sensor] RAW MQTT PACKET: fa32fe0e090600090600090600000000000000000000000705fffe0d020205020205020205000000000000000000030000ff
2026-01-09 19:32:54.167 DEBUG (MainThread) [custom_components.taylor_grill.sensor] RAW MQTT PACKET: fa32fe0e090600090600090600000000000000000000000705fffe0d020205020205020205000000000000000000030000ff
2026-01-09 19:32:54.168 DEBUG (MainThread) [custom_components.taylor_grill.climate] RAW MQTT PACKET (Climate): fa32fe0e090600090600090600000000000000000000000705fffe0d020205020205020205000000000000000000030000ff
2026-01-09 19:33:13.332 DEBUG (MainThread) [custom_components.taylor_grill.climate] RAW MQTT PACKET (Climate): fa18fe0b01010000000000000000000000000100000000ff
2026-01-09 19:33:13.333 DEBUG (MainThread) [custom_components.taylor_grill.sensor] RAW MQTT PACKET: fa18fe0b01010000000000000000000000000100000000ff
2026-01-09 19:33:13.333 DEBUG (MainThread) [custom_components.taylor_grill.sensor] RAW MQTT PACKET: fa18fe0b01010000000000000000000000000100000000ff
2026-01-09 19:33:13.333 DEBUG (MainThread) [custom_components.taylor_grill.climate] RAW MQTT PACKET (Climate): fa18fe0b01010000000000000000000000000100000000ff
2026-01-09 19:33:13.356 DEBUG (MainThread) [custom_components.taylor_grill.climate] RAW MQTT PACKET (Climate): fa32fe0e090600090600090600000000000000000000000705fffe0d020205020205020205000000000000000000030000ff
2026-01-09 19:33:13.356 DEBUG (MainThread) [custom_components.taylor_grill.sensor] RAW MQTT PACKET: fa32fe0e090600090600090600000000000000000000000705fffe0d020205020205020205000000000000000000030000ff
2026-01-09 19:33:13.356 DEBUG (MainThread) [custom_components.taylor_grill.sensor] RAW MQTT PACKET: fa32fe0e090600090600090600000000000000000000000705fffe0d020205020205020205000000000000000000030000ff
2026-01-09 19:33:13.357 DEBUG (MainThread) [custom_components.taylor_grill.climate] RAW MQTT PACKET (Climate): fa32fe0e090600090600090600000000000000000000000705fffe0d020205020205020205000000000000000000030000ff
2026-01-09 19:33:13.954 DEBUG (MainThread) [custom_components.taylor_grill.climate] RAW MQTT PACKET (Climate): fa18fe0b02020000000000000000000000000100000000ff
2026-01-09 19:33:13.955 DEBUG (MainThread) [custom_components.taylor_grill.sensor] RAW MQTT PACKET: fa18fe0b02020000000000000000000000000100000000ff
2026-01-09 19:33:13.955 DEBUG (MainThread) [custom_components.taylor_grill.sensor] RAW MQTT PACKET: fa18fe0b02020000000000000000000000000100000000ff
2026-01-09 19:33:13.955 DEBUG (MainThread) [custom_components.taylor_grill.climate] RAW MQTT PACKET (Climate): fa18fe0b02020000000000000000000000000100000000ff
2026-01-09 19:33:14.134 DEBUG (MainThread) [custom_components.taylor_grill.climate] RAW MQTT PACKET (Climate): fa32fe0e090600090600090600000000000000000000000705fffe0d020205020205020205000000000000000000030500ff
2026-01-09 19:33:14.135 DEBUG (MainThread) [custom_components.taylor_grill.sensor] RAW MQTT PACKET: fa32fe0e090600090600090600000000000000000000000705fffe0d020205020205020205000000000000000000030500ff
2026-01-09 19:33:14.135 DEBUG (MainThread) [custom_components.taylor_grill.sensor] RAW MQTT PACKET: fa32fe0e090600090600090600000000000000000000000705fffe0d020205020205020205000000000000000000030500ff
2026-01-09 19:33:14.135 DEBUG (MainThread) [custom_components.taylor_grill.climate] RAW MQTT PACKET (Climate): fa32fe0e090600090600090600000000000000000000000705fffe0d020205020205020205000000000000000000030500ff
2026-01-09 19:33:33.488 DEBUG (MainThread) [custom_components.taylor_grill.climate] RAW MQTT PACKET (Climate): fa18fe0b02020000000000000000000000000100000000ff
2026-01-09 19:33:33.488 DEBUG (MainThread) [custom_components.taylor_grill.sensor] RAW MQTT PACKET: fa18fe0b02020000000000000000000000000100000000ff
2026-01-09 19:33:33.489 DEBUG (MainThread) [custom_components.taylor_grill.sensor] RAW MQTT PACKET: fa18fe0b02020000000000000000000000000100000000ff
2026-01-09 19:33:33.489 DEBUG (MainThread) [custom_components.taylor_grill.climate] RAW MQTT PACKET (Climate): fa18fe0b02020000000000000000000000000100000000ff
2026-01-09 19:33:33.513 DEBUG (MainThread) [custom_components.taylor_grill.climate] RAW MQTT PACKET (Climate): fa32fe0e090600090600090600000000000000000000000705fffe0d020205020205020205000000000000000000030500ff
2026-01-09 19:33:33.514 DEBUG (MainThread) [custom_components.taylor_grill.sensor] RAW MQTT PACKET: fa32fe0e090600090600090600000000000000000000000705fffe0d020205020205020205000000000000000000030500ff
2026-01-09 19:33:33.514 DEBUG (MainThread) [custom_components.taylor_grill.sensor] RAW MQTT PACKET: fa32fe0e090600090600090600000000000000000000000705fffe0d020205020205020205000000000000000000030500ff
2026-01-09 19:33:33.514 DEBUG (MainThread) [custom_components.taylor_grill.climate] RAW MQTT PACKET (Climate): fa32fe0e090600090600090600000000000000000000000705fffe0d020205020205020205000000000000000000030500ff
2026-01-09 19:33:33.930 DEBUG (MainThread) [custom_components.taylor_grill.climate] RAW MQTT PACKET (Climate): fa18fe0b02020000000000000000000000000100000000ff
2026-01-09 19:33:33.931 DEBUG (MainThread) [custom_components.taylor_grill.sensor] RAW MQTT PACKET: fa18fe0b02020000000000000000000000000100000000ff
2026-01-09 19:33:33.931 DEBUG (MainThread) [custom_components.taylor_grill.sensor] RAW MQTT PACKET: fa18fe0b02020000000000000000000000000100000000ff
2026-01-09 19:33:33.931 DEBUG (MainThread) [custom_components.taylor_grill.climate] RAW MQTT PACKET (Climate): fa18fe0b02020000000000000000000000000100000000ff
2026-01-09 19:33:34.112 DEBUG (MainThread) [custom_components.taylor_grill.climate] RAW MQTT PACKET (Climate): fa32fe0e090600090600090600000000000000000000000705fffe0d020205020205020205000000000000000000030500ff
2026-01-09 19:33:34.113 DEBUG (MainThread) [custom_components.taylor_grill.sensor] RAW MQTT PACKET: fa32fe0e090600090600090600000000000000000000000705fffe0d020205020205020205000000000000000000030500ff
2026-01-09 19:33:34.113 DEBUG (MainThread) [custom_components.taylor_grill.sensor] RAW MQTT PACKET: fa32fe0e090600090600090600000000000000000000000705fffe0d020205020205020205000000000000000000030500ff
2026-01-09 19:33:34.113 DEBUG (MainThread) [custom_components.taylor_grill.climate] RAW MQTT PACKET (Climate): fa32fe0e090600090600090600000000000000000000000705fffe0d020205020205020205000000000000000000030500ff

```

**Comment by death2all110** [comment]
Thank you!
I also just tested and ran into the same thing :(  So sorry!

**Comment by death2all110** [comment]
@ukiews new release is now available. This should fix the issue of the set temp not being respected as well as the set temp not updating in HomeAssistant when changed from the controller.

**Comment by ukiews** [comment]
Running 1.2.1
It does not appear to resolve the issue in either direction…

**Comment by death2all110** [comment]
I know I didn't respond but I assure you I have been spending the past 2 days cranking away at this.

That all being said, a new release has been pushed out. Temp control should be 100% working and if you change the temp from the control panel on the smoker, it should reflect within a couple of seconds in HomeAssistant.

**Comment by ukiews** [comment]
Integration not loading now ("Failed to set up: check the logs").
Here is the log:

```
Logger: homeassistant.config_entries
Source: config_entries.py:762
First occurred: 11:38:58 (3 occurrences)
Last logged: 11:43:25

Error setting up entry Taylor Grill Smoker for taylor_grill
Traceback (most recent call last):
  File "/usr/src/homeassistant/homeassistant/config_entries.py", line 762, in __async_setup_with_context
    result = await component.async_setup_entry(hass, self)
             ^^^^^^^^^^^^^^^^^^^^^^^^^^^^^^^^^^^^^^^^^^^^^
  File "/config/custom_components/taylor_grill/__init__.py", line 17, in async_setup_entry
    await hass.config_entries.async_forward_entry_setups(entry, PLATFORMS)
  File "/usr/src/homeassistant/homeassistant/config_entries.py", line 2611, in async_forward_entry_setups
    await integration.async_get_platforms(platforms)
  File "/usr/src/homeassistant/homeassistant/loader.py", line 1188, in async_get_platforms
    import_future.result()
    ~~~~~~~~~~~~~~~~~~~~^^
  File "/usr/src/homeassistant/homeassistant/loader.py", line 1188, in async_get_platforms
    import_future.result()
    ~~~~~~~~~~~~~~~~~~~~^^
  File "/usr/src/homeassistant/homeassistant/loader.py", line 1188, in async_get_platforms
    import_future.result()
    ~~~~~~~~~~~~~~~~~~~~^^
  File "/usr/src/homeassistant/homeassistant/loader.py", line 1176, in async_get_platforms
    platforms.update(self._load_platforms(platform_names))
                     ~~~~~~~~~~~~~~~~~~~~^^^^^^^^^^^^^^^^
  File "/usr/src/homeassistant/homeassistant/loader.py", line 1101, in _load_platforms
    platform_name: self._load_platform(platform_name)
                   ~~~~~~~~~~~~~~~~~~~^^^^^^^^^^^^^^^
  File "/usr/src/homeassistant/homeassistant/loader.py", line 1275, in _load_platform
    cache[full_name] = self._import_platform(platform_name)
                       ~~~~~~~~~~~~~~~~~~~~~^^^^^^^^^^^^^^^
  File "/usr/src/homeassistant/homeassistant/loader.py", line 1307, in _import_platform
    return importlib.import_module(f"{self.pkg_path}.{platform_name}")
           ~~~~~~~~~~~~~~~~~~~~~~~^^^^^^^^^^^^^^^^^^^^^^^^^^^^^^^^^^^^
  File "/usr/src/homeassistant/homeassistant/util/loop.py", line 201, in protected_loop_func
    return func(*args, **kwargs)
  File "/usr/local/lib/python3.13/importlib/__init__.py", line 88, in import_module
    return _bootstrap._gcd_import(name[level:], package, level)
           ~~~~~~~~~~~~~~~~~~~~~~^^^^^^^^^^^^^^^^^^^^^^^^^^^^^^
  File "<frozen importlib._bootstrap>", line 1387, in _gcd_import
  File "<frozen importlib._bootstrap>", line 1360, in _find_and_load
  File "<frozen importlib._bootstrap>", line 1331, in _find_and_load_unlocked
  File "<frozen importlib._bootstrap>", line 935, in _load_unlocked
  File "<frozen importlib._bootstrap_external>", line 1023, in exec_module
  File "<frozen importlib._bootstrap>", line 488, in _call_with_frames_removed
  File "/config/custom_components/taylor_grill/climate.py", line 24, in <module>
    from .const import CONF_DEVICE_ID, CONF_POLL_INTERVAL, DEFAULT_POLL_INTERVAL, CONF_TEMP_UNIT, DEFAULT_TEMP_UNIT
ImportError: cannot import name 'CONF_POLL_INTERVAL' from 'custom_components.taylor_grill.const' (/config/custom_components/taylor_grill/const.py)
```

Here is a warning:

```
Logger: homeassistant.util.loop
Source: util/loop.py:137
First occurred: 11:38:58 (1 occurrence)
Last logged: 11:38:58

Detected blocking call to import_module with args ('custom_components.taylor_grill.climate',) inside the event loop by custom integration 'taylor_grill' at custom_components/taylor_grill/__init__.py, line 17: await hass.config_entries.async_forward_entry_setups(entry, PLATFORMS) (offender: /usr/src/homeassistant/homeassistant/loader.py, line 1307: return importlib.import_module(f"{self.pkg_path}.{platform_name}")), please create a bug report at https://github.com/death2all110/ha-taylorgrill/issues For developers, please see https://developers.home-assistant.io/docs/asyncio_blocking_operations/#import_module Traceback (most recent call last): File "<frozen runpy>", line 198, in _run_module_as_main File "<frozen runpy>", line 88, in _run_code File "/usr/src/homeassistant/homeassistant/__main__.py", line 229, in <module> sys.exit(main()) File "/usr/src/homeassistant/homeassistant/__main__.py", line 215, in main exit_code = runner.run(runtime_conf) File "/usr/src/homeassistant/homeassistant/runner.py", line 289, in run return loop.run_until_complete(setup_and_run_hass(runtime_config)) File "/usr/local/lib/python3.13/asyncio/base_events.py", line 712, in run_until_complete self.run_forever() File "/usr/local/lib/python3.13/asyncio/base_events.py", line 683, in run_forever self._run_once() File "/usr/local/lib/python3.13/asyncio/base_events.py", line 2050, in _run_once handle._run() File "/usr/local/lib/python3.13/asyncio/events.py", line 89, in _run self._context.run(self._callback, *self._args) File "/usr/src/homeassistant/homeassistant/config_entries.py", line 928, in async_setup_locked await self.async_setup(hass, integration=integration) File "/usr/src/homeassistant/homeassistant/config_entries.py", line 672, in async_setup await self.__async_setup_with_context(hass, integration) File "/usr/src/homeassistant/homeassistant/config_entries.py", line 762, in __async_setup_with_context result = await component.async_setup_entry(hass, self) File "/config/custom_components/taylor_grill/__init__.py", line 17, in async_setup_entry await hass.config_entries.async_forward_entry_setups(entry, PLATFORMS)
```

**Comment by death2all110** [comment]
Sorry about that! Looks like a commit was missing from the release. Just did a re-release of v1.2.2 So if you go into the integration in HACS, click the 3 dots and choose Re-download. Then restart HA, it should be working

<img width="1914" height="261" alt="Image" src="https://github.com/user-attachments/assets/563cffb4-a2c0-4c9a-ab9e-e029c5b2cb41" />

**Comment by ukiews** [comment]
Working! Thank you!

There those however still seem to be an issue with how the temp is reported. I'm seeing about 40F difference:

<img width="588" height="578" alt="Image" src="https://github.com/user-attachments/assets/927562ad-3c7a-4df9-99e2-32a503ce7aae" />

Polling is set to 10 seconds

**Comment by death2all110** [comment]
Excellent. I actually removed the polling option, its now hard coded at 2 seconds which is the same as the app. Allowing it to vary was causing issues.

I looked into the temp variance. However, I don't think its actually a bug in the code, I think its just how the firmware of the controller behaves. Likely smooths it rather than providing the constant raw data that the app and HA are receiving. Unfortunately, I don't have any way to read the firmware on the STM32 microcontroller that actually handles everything.

**Comment by ukiews** [comment]
Thank you again for the excellent work!

“Likely smooths it rather than providing the constant raw data that the app and HA are receiving“
Hard to interpret this as “smoothing” since the difference is so high. I assume the controller is showing the correct value??

**Comment by death2all110** [comment]
The smoothing thing is just an assumption/hypothesis. I Honestly couldn't tell you as I can't see what the controller's micro-controller firmware does, unfortunately. The display is also handled by the micro-controller. I wish I could look at it but I can't understand assembly language. Lol. All I do know is that it forwards a raw hex data stream to the ESP32 chip which is what we interface with. You can always use an analog thermometer in there near the stock probe to see which matches, and then if the display is correct, you can apply a template in HA to correct the temperature value.

Anyway, since everything seems to be working now, I'm going to mark this issue as closed. 

Thanks for sticking with me through all this!
